case_id,title,description,category,ipc_sections,court,year,state,verdict,petitioner,respondent,judge
92,Senior Citizen Property Rights,"Son occupied entire property kicking out elderly parents. Parents filed case under Senior Citizens Act.",Family,Senior Citizens Act,Maintenance Tribunal,2022,Kerala,Son Ordered to Vacate + Pay Maintenance,Elderly Parents,Adult Son,Maintenance Tribunal
93,Vigilante Mob Lynching Criminal,"Mob lynched man on suspicion of theft. 8 accused including mob leader arrested. Murder and rioting charges.",Criminal,302 147 148 IPC,Sessions Court,2022,Jharkhand,5 Convicted - 10 Years Life Imprisonment,State of Jharkhand,Vigilante Mob Members,Sessions Judge
94,Deepfake Video Cyber Case,"Accused created deepfake intimate video of victim and posted online. Novel cyber crime case under IT Act.",Cyber Crime,IT Act 67 66E IPC 354C,Sessions Court,2023,Telangana,Convicted - 5 Years + Fine 2 Lakhs,State of Telangana,Deepfake Creator,Sessions Judge
95,Medical Research Ethics Case,"Clinical trial conducted without proper consent from tribal participants. Ethics violation case filed.",Criminal,IPC 319 ICMR Guidelines,Sessions Court,2022,Odisha,Research Halted + Company Fined,Tribal Participants,Pharmaceutical Company,Sessions Judge
96,Temple Trust Corruption Case,"Temple trust officials siphoned crores donated by devotees. CAG audit revealed misappropriation. HR-CE complaint.",Criminal,409 420 IPC,Sessions Court,2022,Tamil Nadu,Trust Officials Arrested - Trial Ongoing,HR-CE Department,Temple Trust Officials,Sessions Judge
97,Construction Worker Death ESIC,"Construction worker died due to employer negligence. ESIC not enrolled. Family sued for compensation.",Labour,ESI Act Workmens Compensation,Labour Court,2022,Delhi,Rs 30 Lakhs Compensation + ESIC Penalty,Deceased Worker Family,Construction Company,Labour Court Judge
98,Green Bond Fraud SEBI,"Company raised green bonds falsely claiming environmental projects. SEBI investigated. Investor fraud detected.",Criminal,SEBI Act 420 IPC,Special Court,2023,Mumbai,Arrested - Case Under Trial,SEBI + Investors,Company Management,Special Court Judge
99,Wildlife Poaching Criminal Case,"Accused killed protected tiger and sold skin to smugglers. Forest department caught with evidence.",Criminal,Wildlife Protection Act 9 39 51,Sessions Court,2022,Madhya Pradesh,Convicted - 7 Years,State via Forest Department,Poaching Gang,Sessions Judge
100,Vaccine Damage Compensation Case,"Child developed severe reaction after vaccination. Government denied nexus. Consumer + civil case filed.",Consumer,Consumer Protection Act,High Court,2022,Kerala,Expert Committee to Determine Compensation,Child's Parents,State Health Department,High Court Judge
